<?xml version="1.0" encoding="windows-1250"?>
<!DOCTYPE base SYSTEM "base.dtd">
<base>

<!--******************** Global properties ********************-->

 <global>
  <description>Nemoci1</description>
  <expert>PB</expert>
  <date>4.6.2003</date>
  <inference_mechanism>logical</inference_mechanism>
  <weight_range>3</weight_range>
  <default_weight>unknown</default_weight>
  <global_priority>first</global_priority>
  <context_global_threshold>0,000</context_global_threshold>
  <condition_global_threshold>0,000</condition_global_threshold>
 </global>

<!--******************** Attributes and propositions ********************-->

 <attributes>

  <attribute>
   <id>diagnoza</id>
   <type>multiple</type>
   <propositions>
    <proposition>
     <id>Nachlazeni</id>
    </proposition>
    <proposition>
     <id>Chripka</id>
    </proposition>
    <proposition>
     <id>TBC</id>
    </proposition>
   </propositions>
  </attribute>

  <attribute>
   <id>bledost</id>
   <name>pacient je bledy</name>
   <type>binary</type>
  </attribute>

  <attribute>
   <id>dychavicnost</id>
   <type>binary</type>
  </attribute>

  <attribute>
   <id>plice</id>
   <type>binary</type>
  </attribute>

  <attribute>
   <id>HCD</id>
   <type>binary</type>
  </attribute>

  <attribute>
   <id>teplota</id>
   <name>teplota pacienta</name>
   <type>numeric</type>
   <legal_values>
    <lower_bound>35,000</lower_bound>
    <upper_bound>42,000</upper_bound>
   </legal_values>
   <propositions>
    <proposition>
     <id>normalni</id>
     <name>pacient ma normalni teplotu</name>
     <weight_function>
      <fuzzy_lower_bound>35,000</fuzzy_lower_bound>
      <crisp_lower_bound>35,000</crisp_lower_bound>
      <crisp_upper_bound>36,800</crisp_upper_bound>
      <fuzzy_upper_bound>37,500</fuzzy_upper_bound>
     </weight_function>
    </proposition>
    <proposition>
     <id>zvysena</id>
     <name>pacient ma zvysenou teplotu</name>
     <weight_function>
      <fuzzy_lower_bound>36,500</fuzzy_lower_bound>
      <crisp_lower_bound>37,500</crisp_lower_bound>
      <crisp_upper_bound>42,000</crisp_upper_bound>
      <fuzzy_upper_bound>42,000</fuzzy_upper_bound>
     </weight_function>
    </proposition>
   </propositions>
  </attribute>

  <attribute>
   <id>priznaky</id>
   <name>dalsi priznaky</name>
   <type>multiple</type>
   <propositions>
    <proposition>
     <id>kasel</id>
    </proposition>
    <proposition>
     <id>ryma</id>
    </proposition>
   </propositions>
  </attribute>
 </attributes>

<!--******************** Contexts ********************-->

 <contexts>
 </contexts>

<!--******************** Rules ********************-->

 <rules>

<!--******************** Apriori rules ********************-->

  <apriori_rules>
  </apriori_rules>

<!--******************** Logical rules ********************-->

  <logical_rules>
  </logical_rules>

<!--******************** Compositional rules ********************-->

  <compositional_rules>

   <compositional_rule>
    <id>c1</id>
    <condition>
    <conjunction>
     <literal>
      <id_attribute>bledost</id_attribute>
      <negation>0</negation>
     </literal>
    </conjunction>
    </condition>
    <conclusions>
     <conclusion>
      <id_attribute>diagnoza</id_attribute>
      <id_proposition>TBC</id_proposition>
      <negation>0</negation>
      <weight>1,000</weight>
     </conclusion>
    </conclusions>
   </compositional_rule>

   <compositional_rule>
    <id>c2</id>
    <condition>
    <conjunction>
     <literal>
      <id_attribute>dychavicnost</id_attribute>
      <negation>0</negation>
     </literal>
    </conjunction>
    </condition>
    <conclusions>
     <conclusion>
      <id_attribute>plice</id_attribute>
      <negation>0</negation>
      <weight>2,000</weight>
     </conclusion>
    </conclusions>
   </compositional_rule>

   <compositional_rule>
    <id>c3</id>
    <condition>
    <conjunction>
     <literal>
      <id_attribute>priznaky</id_attribute>
      <id_proposition>kasel</id_proposition>
      <negation>0</negation>
     </literal>
    </conjunction>
    </condition>
    <conclusions>
     <conclusion>
      <id_attribute>plice</id_attribute>
      <negation>0</negation>
      <weight>2,000</weight>
     </conclusion>
    </conclusions>
   </compositional_rule>

   <compositional_rule>
    <id>c4</id>
    <condition>
    <conjunction>
     <literal>
      <id_attribute>priznaky</id_attribute>
      <id_proposition>kasel</id_proposition>
      <negation>0</negation>
     </literal>
    </conjunction>
    </condition>
    <conclusions>
     <conclusion>
      <id_attribute>HCD</id_attribute>
      <negation>0</negation>
      <weight>3,000</weight>
     </conclusion>
    </conclusions>
   </compositional_rule>

   <compositional_rule>
    <id>c5</id>
    <condition>
    <conjunction>
     <literal>
      <id_attribute>priznaky</id_attribute>
      <id_proposition>ryma</id_proposition>
      <negation>0</negation>
     </literal>
    </conjunction>
    </condition>
    <conclusions>
     <conclusion>
      <id_attribute>HCD</id_attribute>
      <negation>0</negation>
      <weight>2,000</weight>
     </conclusion>
    </conclusions>
   </compositional_rule>

   <compositional_rule>
    <id>c6</id>
    <condition>
    <conjunction>
     <literal>
      <id_attribute>plice</id_attribute>
      <negation>0</negation>
     </literal>
    </conjunction>
    </condition>
    <conclusions>
     <conclusion>
      <id_attribute>diagnoza</id_attribute>
      <id_proposition>TBC</id_proposition>
      <negation>0</negation>
      <weight>2,000</weight>
     </conclusion>
    </conclusions>
   </compositional_rule>

   <compositional_rule>
    <id>c7</id>
    <condition>
    <conjunction>
     <literal>
      <id_attribute>HCD</id_attribute>
      <negation>0</negation>
     </literal>
     <literal>
      <id_attribute>teplota</id_attribute>
      <id_proposition>zvysena</id_proposition>
      <negation>0</negation>
     </literal>
    </conjunction>
    </condition>
    <conclusions>
     <conclusion>
      <id_attribute>diagnoza</id_attribute>
      <id_proposition>Chripka</id_proposition>
      <negation>0</negation>
      <weight>3,000</weight>
     </conclusion>
    </conclusions>
   </compositional_rule>

   <compositional_rule>
    <id>c8</id>
    <condition>
    <conjunction>
     <literal>
      <id_attribute>HCD</id_attribute>
      <negation>0</negation>
     </literal>
     <literal>
      <id_attribute>teplota</id_attribute>
      <id_proposition>normalni</id_proposition>
      <negation>0</negation>
     </literal>
    </conjunction>
    </condition>
    <conclusions>
     <conclusion>
      <id_attribute>diagnoza</id_attribute>
      <id_proposition>Nachlazeni</id_proposition>
      <negation>0</negation>
      <weight>3,000</weight>
     </conclusion>
    </conclusions>
   </compositional_rule>
  </compositional_rules>
 </rules>

<!--******************** Integrity constraints ********************-->

 <integrity_constraints>
 </integrity_constraints>
 <system_info>
  <nest:options xmlns:nest="http://lisp.vse.cz/NEST">
   <nest:version>2.0.4</nest:version>
  </nest:options>
 </system_info>
</base>
